instruction,intent,category,baseline_output,naive_rag_output,reference,baseline_rouge1,baseline_rougeL,baseline_bleu,naive_rag_rouge1,naive_rag_rougeL,naive_rag_bleu,baseline_hallucination,naive_rag_hallucination
I need help with technical troubleshooting for order 100180,technical_troubleshooting,TECHNICAL,Please contact support with your order details. The team will review the issue and provide an update as soon as possible.,"According to the Technical Troubleshooting SOP: Covers product and platform technical issues: app crashes, login failures caused by the client, sync errors, broken features, errors on checkout, and performance problems. Account access policy questions follow account recovery. 1. Capture the exact symptom, when it started, and whether it is reproducible. 2. Record environment: app or browser version, operating system, and device. 3. Try the standard recovery sequence: update to the latest version, restart the app, clear cache, and retry on another network or device. 4. Confirm whether the issue is account-specific or affects all users (check the status dashboard for a known incident). For repeatable crashes, collect the action that trigger","# Technical Troubleshooting ## Scope Covers product and platform technical issues: app crashes, login failures caused by the client, sync errors, broken features, errors on checkout, and performance problems. Account access policy questions follow account recovery. ## First-Line Steps 1. Capture the exact symptom, when it started, and whether it is reproducible. 2. Record environment: app or browser version, operating system, and device. 3. Try the standard recovery sequence: update to the latest version, restart the app, clear cache, and retry on another network or device. 4. Confirm whether the issue is account-specific or affects all users (check the status dashboard for a known incident). ## Crashes And Errors For repeatable crashes, collect the action that triggers it and any error code or screenshot. For checkout or payment errors, do not retry charges repeatedly — confirm whether ",0.03731343283582089,0.029850746268656716,0.00011181645658544262,0.7985074626865671,0.7985074626865671,0.7522877097027986,False,False
I need help with technical troubleshooting for order 105185,technical_troubleshooting,TECHNICAL,Please contact support with your order details. The team will review the issue and provide an update as soon as possible.,"According to the Technical Troubleshooting SOP: Covers product and platform technical issues: app crashes, login failures caused by the client, sync errors, broken features, errors on checkout, and performance problems. Account access policy questions follow account recovery. 1. Capture the exact symptom, when it started, and whether it is reproducible. 2. Record environment: app or browser version, operating system, and device. 3. Try the standard recovery sequence: update to the latest version, restart the app, clear cache, and retry on another network or device. 4. Confirm whether the issue is account-specific or affects all users (check the status dashboard for a known incident). For repeatable crashes, collect the action that trigger","# Technical Troubleshooting ## Scope Covers product and platform technical issues: app crashes, login failures caused by the client, sync errors, broken features, errors on checkout, and performance problems. Account access policy questions follow account recovery. ## First-Line Steps 1. Capture the exact symptom, when it started, and whether it is reproducible. 2. Record environment: app or browser version, operating system, and device. 3. Try the standard recovery sequence: update to the latest version, restart the app, clear cache, and retry on another network or device. 4. Confirm whether the issue is account-specific or affects all users (check the status dashboard for a known incident). ## Crashes And Errors For repeatable crashes, collect the action that triggers it and any error code or screenshot. For checkout or payment errors, do not retry charges repeatedly — confirm whether ",0.03731343283582089,0.029850746268656716,0.00011181645658544262,0.7985074626865671,0.7985074626865671,0.7522877097027986,False,False
I need help with order tracking for order 103800,order_tracking,ORDERS,Please contact support with your order details. The team will review the issue and provide an update as soon as possible.,"According to the Order Tracking SOP: Helps customers locate an order and interpret its status. Orders that have clearly exceeded their delivery window follow the shipping delays procedure. - **Processing:** payment confirmed, not yet packed. - **Preparing to ship:** packed, awaiting carrier pickup. - **In transit:** carrier has the parcel; tracking events update as it moves. - **Out for delivery:** on the vehicle for delivery that day. - **Delivered:** carrier marked the parcel delivered. - **Exception:** address issue, failed delivery, or held parcel needing action. Locate the order by its identifier and the registered email. Provide the tracking number and carrier link. Tracking can take up to 24 hours to show the first scan ","# Order Tracking ## Scope Helps customers locate an order and interpret its status. Orders that have clearly exceeded their delivery window follow the shipping delays procedure. ## Order States - **Processing:** payment confirmed, not yet packed. - **Preparing to ship:** packed, awaiting carrier pickup. - **In transit:** carrier has the parcel; tracking events update as it moves. - **Out for delivery:** on the vehicle for delivery that day. - **Delivered:** carrier marked the parcel delivered. - **Exception:** address issue, failed delivery, or held parcel needing action. ## Finding The Order Locate the order by its identifier and the registered email. Provide the tracking number and carrier link. Tracking can take up to 24 hours to show the first scan after a label is created, so a label with no movement on day one is expected, not lost. ## ""Delivered But Not Received"" 1. Confirm the sh",0.07352941176470588,0.04411764705882353,0.00012089319216996199,0.7720588235294118,0.7647058823529411,0.7147360267465687,False,False
I need help with data privacy for order 103395,data_privacy,PRIVACY,Please contact support with your order details. The team will review the issue and provide an update as soon as possible.,"According to the Data Privacy SOP: Covers customer requests about their personal data: what is held, access copies, correction, deletion, marketing preferences, and concerns about how data is used. Collect only what is needed, use it only for stated purposes, and never share customer data with unauthorized parties. Agents access customer records only to resolve the customer's own request. - **Access:** the customer may request a copy of their personal data. Fulfilled within the statutory window after identity verification. - **Correction:** inaccurate details are updated through the verified-change workflow. - **Deletion:** account and personal data are deleted on request, except records that must be retained for legal, tax, ","# Data Privacy ## Scope Covers customer requests about their personal data: what is held, access copies, correction, deletion, marketing preferences, and concerns about how data is used. ## Core Principles Collect only what is needed, use it only for stated purposes, and never share customer data with unauthorized parties. Agents access customer records only to resolve the customer's own request. ## Data Subject Requests - **Access:** the customer may request a copy of their personal data. Fulfilled within the statutory window after identity verification. - **Correction:** inaccurate details are updated through the verified-change workflow. - **Deletion:** account and personal data are deleted on request, except records that must be retained for legal, tax, or fraud-prevention reasons; explain any such retention plainly. - **Marketing opt-out:** honored promptly and does not affect essen",0.0390625,0.03125,8.367387139141083e-05,0.8046875,0.8046875,0.7568895811231479,False,False
I need help with shipping delays for order 102895,shipping_delays,ORDERS,Please contact support with your order details. The team will review the issue and provide an update as soon as possible.,"According to the Order Tracking SOP: Helps customers locate an order and interpret its status. Orders that have clearly exceeded their delivery window follow the shipping delays procedure. - **Processing:** payment confirmed, not yet packed. - **Preparing to ship:** packed, awaiting carrier pickup. - **In transit:** carrier has the parcel; tracking events update as it moves. - **Out for delivery:** on the vehicle for delivery that day. - **Delivered:** carrier marked the parcel delivered. - **Exception:** address issue, failed delivery, or held parcel needing action. Locate the order by its identifier and the registered email. Provide the tracking number and carrier link. Tracking can take up to 24 hours to show the first scan ","# Shipping Delays ## Scope This procedure covers orders that have shipped but are running behind the estimated delivery date, as well as orders stuck in a pre-shipment state. ## Standard Timelines Domestic orders deliver within 3–7 business days; international orders within 10–21 business days. An order is only considered ""delayed"" once it has passed the upper bound of its quoted window. Carrier scans can lag reality by up to 24 hours, so a single stale tracking event is not by itself a delay. ## Agent Steps 1. Confirm the order identifier and the original estimated window. 2. Check the latest carrier scan and the warehouse dispatch status. 3. If the parcel is in transit but late, open a carrier trace and tell the customer to expect an update within 24–48 hours. 4. If the parcel shows no movement for more than 5 business days, treat it as potentially lost and offer a replacement shipment",0.05161290322580645,0.04516129032258064,4.626379333889169e-05,0.3096774193548387,0.12903225806451613,0.04295235163164187,False,False
I need help with account recovery for order 101755,account_recovery,ACCOUNT,Please contact support with your order details. The team will review the issue and provide an update as soon as possible.,"According to the Account Recovery SOP: Use this procedure when a customer cannot access their account due to a lockout, a lost email address, suspected unauthorized access, or a disabled account — anything beyond a simple forgotten password (see the password reset procedure for that case). Before any recovery action, verify identity with at least two of: the registered email, the last order identifier, the billing postal code, or the last four digits of the payment method on file. Never read back full payment details or one-time codes to the customer. Accounts lock for 30 minutes after five failed sign-in attempts. If the customer did not make those attempts, treat it as a possible compromise: unlock only after identity verificat","# Account Recovery ## When To Use Use this procedure when a customer cannot access their account due to a lockout, a lost email address, suspected unauthorized access, or a disabled account — anything beyond a simple forgotten password (see the password reset procedure for that case). ## Identity Verification Before any recovery action, verify identity with at least two of: the registered email, the last order identifier, the billing postal code, or the last four digits of the payment method on file. Never read back full payment details or one-time codes to the customer. ## Lockout After Failed Attempts Accounts lock for 30 minutes after five failed sign-in attempts. If the customer did not make those attempts, treat it as a possible compromise: unlock only after identity verification, force a password reset, and recommend enabling two-factor authentication. ## Lost Or Changed Email If t",0.056338028169014086,0.04929577464788732,4.83159145245251e-05,0.823943661971831,0.8169014084507042,0.7767511698293887,False,False
I need help with product return for order 104635,product_return,RETURNS,Please contact support with your order details. The team will review the issue and provide an update as soon as possible.,"According to the Product Return SOP: Covers physically returning an item, whether for a refund, an exchange, or a warranty replacement. The monetary outcome is governed by the refund policy; this procedure covers the logistics of getting the item back. Items may be returned within 30 days of delivery. They should be in resalable condition with original packaging where practical. Defective or incorrectly-shipped items can be returned at any reasonable time and never incur a restocking deduction. 1. Issue a prepaid return label for defective or wrong-item cases at no cost to the customer. 2. For change-of-mind returns, the customer may be responsible for return shipping unless a free-returns promotion applies. 3. Provide a return","# Product Return ## Scope Covers physically returning an item, whether for a refund, an exchange, or a warranty replacement. The monetary outcome is governed by the refund policy; this procedure covers the logistics of getting the item back. ## Return Window Items may be returned within 30 days of delivery. They should be in resalable condition with original packaging where practical. Defective or incorrectly-shipped items can be returned at any reasonable time and never incur a restocking deduction. ## Return Methods 1. Issue a prepaid return label for defective or wrong-item cases at no cost to the customer. 2. For change-of-mind returns, the customer may be responsible for return shipping unless a free-returns promotion applies. 3. Provide a return reference and instructions for drop-off or pickup. ## Exchanges For size, color, or model swaps, create the replacement order on a hold an",0.05555555555555555,0.034722222222222224,4.392672498345256e-05,0.8125,0.8055555555555556,0.7628625920701527,False,False
I need help with account recovery for order 102275,account_recovery,ACCOUNT,Please contact support with your order details. The team will review the issue and provide an update as soon as possible.,"According to the Account Recovery SOP: Use this procedure when a customer cannot access their account due to a lockout, a lost email address, suspected unauthorized access, or a disabled account — anything beyond a simple forgotten password (see the password reset procedure for that case). Before any recovery action, verify identity with at least two of: the registered email, the last order identifier, the billing postal code, or the last four digits of the payment method on file. Never read back full payment details or one-time codes to the customer. Accounts lock for 30 minutes after five failed sign-in attempts. If the customer did not make those attempts, treat it as a possible compromise: unlock only after identity verificat","# Account Recovery ## When To Use Use this procedure when a customer cannot access their account due to a lockout, a lost email address, suspected unauthorized access, or a disabled account — anything beyond a simple forgotten password (see the password reset procedure for that case). ## Identity Verification Before any recovery action, verify identity with at least two of: the registered email, the last order identifier, the billing postal code, or the last four digits of the payment method on file. Never read back full payment details or one-time codes to the customer. ## Lockout After Failed Attempts Accounts lock for 30 minutes after five failed sign-in attempts. If the customer did not make those attempts, treat it as a possible compromise: unlock only after identity verification, force a password reset, and recommend enabling two-factor authentication. ## Lost Or Changed Email If t",0.056338028169014086,0.04929577464788732,4.83159145245251e-05,0.823943661971831,0.8169014084507042,0.7767511698293887,False,False
I need help with billing disputes for order 100690,billing_disputes,BILLING,Please contact support with your order details. The team will review the issue and provide an update as soon as possible.,"According to the Billing Disputes SOP: Use this when a customer questions a charge: an amount they do not recognize, a charge larger than expected, a duplicate charge, or a charge after they believed a service had ended. Refund eligibility itself is governed by the refund policy; this procedure focuses on investigating the charge. 1. Identify the exact charge: date, amount, and descriptor. 2. Match it to an order, subscription renewal, tax/shipping component, or pre-authorization hold. 3. Distinguish a true duplicate from a pending authorization that will drop off automatically within 3–5 business days. - **Pre-authorization holds:** temporary and release on their own; explain rather than refund. - **Proration:** plan changes mid","# Billing Disputes ## Scope Use this when a customer questions a charge: an amount they do not recognize, a charge larger than expected, a duplicate charge, or a charge after they believed a service had ended. Refund eligibility itself is governed by the refund policy; this procedure focuses on investigating the charge. ## Triage 1. Identify the exact charge: date, amount, and descriptor. 2. Match it to an order, subscription renewal, tax/shipping component, or pre-authorization hold. 3. Distinguish a true duplicate from a pending authorization that will drop off automatically within 3–5 business days. ## Common Causes - **Pre-authorization holds:** temporary and release on their own; explain rather than refund. - **Proration:** plan changes mid-cycle create a partial line item. - **Tax or shipping:** shown separately from the item subtotal. - **Genuine duplicate or system error:** rever",0.044444444444444446,0.02962962962962963,6.275095612008766e-05,0.8222222222222222,0.8148148148148148,0.7719396762881455,False,False
I need help with technical troubleshooting for order 105055,technical_troubleshooting,TECHNICAL,Please contact support with your order details. The team will review the issue and provide an update as soon as possible.,"According to the Technical Troubleshooting SOP: Covers product and platform technical issues: app crashes, login failures caused by the client, sync errors, broken features, errors on checkout, and performance problems. Account access policy questions follow account recovery. 1. Capture the exact symptom, when it started, and whether it is reproducible. 2. Record environment: app or browser version, operating system, and device. 3. Try the standard recovery sequence: update to the latest version, restart the app, clear cache, and retry on another network or device. 4. Confirm whether the issue is account-specific or affects all users (check the status dashboard for a known incident). For repeatable crashes, collect the action that trigger","# Technical Troubleshooting ## Scope Covers product and platform technical issues: app crashes, login failures caused by the client, sync errors, broken features, errors on checkout, and performance problems. Account access policy questions follow account recovery. ## First-Line Steps 1. Capture the exact symptom, when it started, and whether it is reproducible. 2. Record environment: app or browser version, operating system, and device. 3. Try the standard recovery sequence: update to the latest version, restart the app, clear cache, and retry on another network or device. 4. Confirm whether the issue is account-specific or affects all users (check the status dashboard for a known incident). ## Crashes And Errors For repeatable crashes, collect the action that triggers it and any error code or screenshot. For checkout or payment errors, do not retry charges repeatedly — confirm whether ",0.03731343283582089,0.029850746268656716,0.00011181645658544262,0.7985074626865671,0.7985074626865671,0.7522877097027986,False,False
I need help with payment methods for order 104920,payment_methods,BILLING,Please contact support with your order details. The team will review the issue and provide an update as soon as possible.,"According to the Payment Methods SOP: The store accepts major credit and debit cards, common digital wallets, and bank transfer for eligible regions. Gift cards and store credit can be combined with one other payment method at checkout. Cash on delivery is not offered for online orders. At checkout the payment is authorized (a temporary hold) and only captured when the order ships. A visible pending hold that does not match the final total is normal and resolves within 3–5 business days; explain this before treating it as a billing dispute. Common causes: insufficient funds, an expired card, a billing-address mismatch, or the bank's fraud screening. Advise the customer to verify card details and contact their bank if the decline","# Payment Methods ## Accepted Methods The store accepts major credit and debit cards, common digital wallets, and bank transfer for eligible regions. Gift cards and store credit can be combined with one other payment method at checkout. Cash on delivery is not offered for online orders. ## Authorization vs Capture At checkout the payment is authorized (a temporary hold) and only captured when the order ships. A visible pending hold that does not match the final total is normal and resolves within 3–5 business days; explain this before treating it as a billing dispute. ## Failed Or Declined Payments Common causes: insufficient funds, an expired card, a billing-address mismatch, or the bank's fraud screening. Advise the customer to verify card details and contact their bank if the decline persists. Never ask the customer to send full card numbers or security codes through chat or email. ##",0.06206896551724138,0.034482758620689655,4.313564199063211e-05,0.8344827586206897,0.8206896551724138,0.782205578295506,False,False
